{
  "dataset": "RajaHasil 4D Results Archive",
  "license": "CC-BY-4.0",
  "attribution": "Data: RajaHasil 4D Results Archive, https://rajahasil.co/data/ (CC BY 4.0)",
  "documentation": "https://rajahasil.co/data/",
  "session_note": "session is a time label in WIB (Asia/Jakarta) published by third-party archives. It is not a verified timestamp and not the local time of the market.",
  "market": "MC",
  "year": 2021,
  "count": 1456,
  "results": [
    {"market":"MC","draw_type":"4D","draw_date":"2021-01-01","session":"13:00","session_timezone":"Asia/Jakarta","result":"1972"},
    {"market":"MC","draw_type":"4D","draw_date":"2021-01-01","session":"16:00","session_timezone":"Asia/Jakarta","result":"5670"},
    {"market":"MC","draw_type":"4D","draw_date":"2021-01-01","session":"19:00","session_timezone":"Asia/Jakarta","result":"6159"},
    {"market":"MC","draw_type":"4D","draw_date":"2021-01-01","session":"22:00","session_timezone":"Asia/Jakarta","result":"4725"},
    {"market":"MC","draw_type":"4D","draw_date":"2021-01-02","session":"13:00","session_timezone":"Asia/Jakarta","result":"7285"},
    {"market":"MC","draw_type":"4D","draw_date":"2021-01-02","session":"16:00","session_timezone":"Asia/Jakarta","result":"4317"},
    {"market":"MC","draw_type":"4D","draw_date":"2021-01-02","session":"19:00","session_timezone":"Asia/Jakarta","result":"1325"},
    {"market":"MC","draw_type":"4D","draw_date":"2021-01-02","session":"22:00","session_timezone":"Asia/Jakarta","result":"3733"},
    {"market":"MC","draw_type":"4D","draw_date":"2021-01-03","session":"13:00","session_timezone":"Asia/Jakarta","result":"4058"},
    {"market":"MC","draw_type":"4D","draw_date":"2021-01-03","session":"16:00","session_timezone":"Asia/Jakarta","result":"7691"},
    {"market":"MC","draw_type":"4D","draw_date":"2021-01-03","session":"19:00","session_timezone":"Asia/Jakarta","result":"7282"},
    {"market":"MC","draw_type":"4D","draw_date":"2021-01-03","session":"22:00","session_timezone":"Asia/Jakarta","result":"4943"},
    {"market":"MC","draw_type":"4D","draw_date":"2021-01-04","session":"13:00","session_timezone":"Asia/Jakarta","result":"4073"},
    {"market":"MC","draw_type":"4D","draw_date":"2021-01-04","session":"16:00","session_timezone":"Asia/Jakarta","result":"3271"},
    {"market":"MC","draw_type":"4D","draw_date":"2021-01-04","session":"19:00","session_timezone":"Asia/Jakarta","result":"4231"},
    {"market":"MC","draw_type":"4D","draw_date":"2021-01-04","session":"22:00","session_timezone":"Asia/Jakarta","result":"8527"},
    {"market":"MC","draw_type":"4D","draw_date":"2021-01-05","session":"13:00","session_timezone":"Asia/Jakarta","result":"8712"},
    {"market":"MC","draw_type":"4D","draw_date":"2021-01-05","session":"16:00","session_timezone":"Asia/Jakarta","result":"4717"},
    {"market":"MC","draw_type":"4D","draw_date":"2021-01-05","session":"19:00","session_timezone":"Asia/Jakarta","result":"7046"},
    {"market":"MC","draw_type":"4D","draw_date":"2021-01-05","session":"22:00","session_timezone":"Asia/Jakarta","result":"8433"},
    {"market":"MC","draw_type":"4D","draw_date":"2021-01-06","session":"13:00","session_timezone":"Asia/Jakarta","result":"3547"},
    {"market":"MC","draw_type":"4D","draw_date":"2021-01-06","session":"16:00","session_timezone":"Asia/Jakarta","result":"7152"},
    {"market":"MC","draw_type":"4D","draw_date":"2021-01-06","session":"19:00","session_timezone":"Asia/Jakarta","result":"2921"},
    {"market":"MC","draw_type":"4D","draw_date":"2021-01-06","session":"22:00","session_timezone":"Asia/Jakarta","result":"0759"},
    {"market":"MC","draw_type":"4D","draw_date":"2021-01-07","session":"13:00","session_timezone":"Asia/Jakarta","result":"8498"},
    {"market":"MC","draw_type":"4D","draw_date":"2021-01-07","session":"16:00","session_timezone":"Asia/Jakarta","result":"2897"},
    {"market":"MC","draw_type":"4D","draw_date":"2021-01-07","session":"19:00","session_timezone":"Asia/Jakarta","result":"7411"},
    {"market":"MC","draw_type":"4D","draw_date":"2021-01-07","session":"22:00","session_timezone":"Asia/Jakarta","result":"3919"},
    {"market":"MC","draw_type":"4D","draw_date":"2021-01-08","session":"13:00","session_timezone":"Asia/Jakarta","result":"6622"},
    {"market":"MC","draw_type":"4D","draw_date":"2021-01-08","session":"16:00","session_timezone":"Asia/Jakarta","result":"6034"},
    {"market":"MC","draw_type":"4D","draw_date":"2021-01-08","session":"19:00","session_timezone":"Asia/Jakarta","result":"1638"},
    {"market":"MC","draw_type":"4D","draw_date":"2021-01-08","session":"22:00","session_timezone":"Asia/Jakarta","result":"5102"},
    {"market":"MC","draw_type":"4D","draw_date":"2021-01-09","session":"13:00","session_timezone":"Asia/Jakarta","result":"1682"},
    {"market":"MC","draw_type":"4D","draw_date":"2021-01-09","session":"16:00","session_timezone":"Asia/Jakarta","result":"2535"},
    {"market":"MC","draw_type":"4D","draw_date":"2021-01-09","session":"19:00","session_timezone":"Asia/Jakarta","result":"6660"},
    {"market":"MC","draw_type":"4D","draw_date":"2021-01-09","session":"22:00","session_timezone":"Asia/Jakarta","result":"0994"},
    {"market":"MC","draw_type":"4D","draw_date":"2021-01-10","session":"13:00","session_timezone":"Asia/Jakarta","result":"6290"},
    {"market":"MC","draw_type":"4D","draw_date":"2021-01-10","session":"16:00","session_timezone":"Asia/Jakarta","result":"0100"},
    {"market":"MC","draw_type":"4D","draw_date":"2021-01-10","session":"19:00","session_timezone":"Asia/Jakarta","result":"5262"},
    {"market":"MC","draw_type":"4D","draw_date":"2021-01-10","session":"22:00","session_timezone":"Asia/Jakarta","result":"3529"},
    {"market":"MC","draw_type":"4D","draw_date":"2021-01-11","session":"13:00","session_timezone":"Asia/Jakarta","result":"1157"},
    {"market":"MC","draw_type":"4D","draw_date":"2021-01-11","session":"16:00","session_timezone":"Asia/Jakarta","result":"0085"},
    {"market":"MC","draw_type":"4D","draw_date":"2021-01-11","session":"19:00","session_timezone":"Asia/Jakarta","result":"2276"},
    {"market":"MC","draw_type":"4D","draw_date":"2021-01-11","session":"22:00","session_timezone":"Asia/Jakarta","result":"3789"},
    {"market":"MC","draw_type":"4D","draw_date":"2021-01-12","session":"13:00","session_timezone":"Asia/Jakarta","result":"7352"},
    {"market":"MC","draw_type":"4D","draw_date":"2021-01-12","session":"16:00","session_timezone":"Asia/Jakarta","result":"2682"},
    {"market":"MC","draw_type":"4D","draw_date":"2021-01-12","session":"19:00","session_timezone":"Asia/Jakarta","result":"6292"},
    {"market":"MC","draw_type":"4D","draw_date":"2021-01-12","session":"22:00","session_timezone":"Asia/Jakarta","result":"6546"},
    {"market":"MC","draw_type":"4D","draw_date":"2021-01-13","session":"13:00","session_timezone":"Asia/Jakarta","result":"3509"},
    {"market":"MC","draw_type":"4D","draw_date":"2021-01-13","session":"16:00","session_timezone":"Asia/Jakarta","result":"9455"},
    {"market":"MC","draw_type":"4D","draw_date":"2021-01-13","session":"19:00","session_timezone":"Asia/Jakarta","result":"2911"},
    {"market":"MC","draw_type":"4D","draw_date":"2021-01-13","session":"22:00","session_timezone":"Asia/Jakarta","result":"4862"},
    {"market":"MC","draw_type":"4D","draw_date":"2021-01-14","session":"13:00","session_timezone":"Asia/Jakarta","result":"1239"},
    {"market":"MC","draw_type":"4D","draw_date":"2021-01-14","session":"16:00","session_timezone":"Asia/Jakarta","result":"3519"},
    {"market":"MC","draw_type":"4D","draw_date":"2021-01-14","session":"19:00","session_timezone":"Asia/Jakarta","result":"0413"},
    {"market":"MC","draw_type":"4D","draw_date":"2021-01-14","session":"22:00","session_timezone":"Asia/Jakarta","result":"5502"},
    {"market":"MC","draw_type":"4D","draw_date":"2021-01-15","session":"13:00","session_timezone":"Asia/Jakarta","result":"6577"},
    {"market":"MC","draw_type":"4D","draw_date":"2021-01-15","session":"16:00","session_timezone":"Asia/Jakarta","result":"6066"},
    {"market":"MC","draw_type":"4D","draw_date":"2021-01-15","session":"19:00","session_timezone":"Asia/Jakarta","result":"9075"},
    {"market":"MC","draw_type":"4D","draw_date":"2021-01-15","session":"22:00","session_timezone":"Asia/Jakarta","result":"5208"},
    {"market":"MC","draw_type":"4D","draw_date":"2021-01-16","session":"13:00","session_timezone":"Asia/Jakarta","result":"0306"},
    {"market":"MC","draw_type":"4D","draw_date":"2021-01-16","session":"16:00","session_timezone":"Asia/Jakarta","result":"0332"},
    {"market":"MC","draw_type":"4D","draw_date":"2021-01-16","session":"19:00","session_timezone":"Asia/Jakarta","result":"6685"},
    {"market":"MC","draw_type":"4D","draw_date":"2021-01-16","session":"22:00","session_timezone":"Asia/Jakarta","result":"9026"},
    {"market":"MC","draw_type":"4D","draw_date":"2021-01-17","session":"13:00","session_timezone":"Asia/Jakarta","result":"0284"},
    {"market":"MC","draw_type":"4D","draw_date":"2021-01-17","session":"16:00","session_timezone":"Asia/Jakarta","result":"5729"},
    {"market":"MC","draw_type":"4D","draw_date":"2021-01-17","session":"19:00","session_timezone":"Asia/Jakarta","result":"1838"},
    {"market":"MC","draw_type":"4D","draw_date":"2021-01-17","session":"22:00","session_timezone":"Asia/Jakarta","result":"3700"},
    {"market":"MC","draw_type":"4D","draw_date":"2021-01-18","session":"13:00","session_timezone":"Asia/Jakarta","result":"7968"},
    {"market":"MC","draw_type":"4D","draw_date":"2021-01-18","session":"16:00","session_timezone":"Asia/Jakarta","result":"1298"},
    {"market":"MC","draw_type":"4D","draw_date":"2021-01-18","session":"19:00","session_timezone":"Asia/Jakarta","result":"0761"},
    {"market":"MC","draw_type":"4D","draw_date":"2021-01-18","session":"22:00","session_timezone":"Asia/Jakarta","result":"4860"},